MIXS ID	Structured comment name	Item	Expected value	Value syntax	Occurrence	Preferred unit	Definition
MIXS:0000582	salt_regm	salt regimen	salt name;salt amount;treatment interval and duration	{text};{float} {unit};{period};{interval};{period}	m	gram, microgram, mole per liter, gram per liter	Information about treatment involving use of salts as supplement to liquid and soil growth media; should include the name of salt, amount administered, treatment regimen including how many times the treatment was repeated, how long each treatment lasted, and the start and end time of the entire treatment; can include multiple salt regimens
MIXS:0001123	farm_equip_shared	equipment shared with other farms					List of planting, growing or harvesting equipment shared with other farms.
MIXS:0000753	oxy_stat_samp	oxygenation status of sample	enumeration	[aerobic|anaerobic|other]	1		Oxygenation status of sample
MIXS:0000758	surf_material	surface material	enumeration	[adobe|carpet|cinder blocks|concrete|hay bales|glass|metal|paint|plastic|stainless steel|stone|stucco|tile|vinyl|wood]	1		Surface materials at the point of sampling.
MIXS:0000037	nucl_acid_ext	nucleic acid extraction	PMID, DOI or URL	{PMID}|{DOI}|{URL}	1		A link to a literature reference, electronic resource or a standard operating procedure (SOP), that describes the material separation to recover the nucleic acid fraction from a sample.
MIXS:0000336	soil_texture_meth	soil texture method	PMID, DOI or URL	{PMID}|{DOI}|{URL}	1		Reference or method used in determining soil texture classification.
MIXS:0000264	host_height	host height	height of the symbiotic organism (host of the samples); measurement value	{float} {unit}	1	nanometre, micrometre, millimeter, centimeter, meter	The height of subject.
MIXS:0001001	ph	pH	measurement value	{float}	1		Ph measurement of the sample, or liquid portion of sample, or aqueous phase of the fluid
MIXS:0000859	genetic_mod	genetic modification	PMID,DOI,url, or text	{PMID}|{DOI}|{URL}|{text}	1		Genetic modifications of the genome of an organism, which may occur naturally by spontaneous mutation, or be introduced by some experimental means, e.g. specification of a transgene or the gene knocked-out or details of transient transfection.
MIXS:0000874	host_phenotype	host phenotype	PATO or HP	{termLabel} {[termID]}	1		Phenotype of human or other host. For phenotypic quality ontology (pato) (v 2018-03-27) terms, please see http://purl.bioontology.org/ontology/pato. For Human Phenotype Ontology (HP) (v 2018-06-13) please see http://purl.bioontology.org/ontology/HP
MIXS:0000867	host_body_site	host body site	body site of the symbiotic organism (host of the samples) where the samples was obtained from; FMA or UBERON	{termLabel} {[termID]}	1		Name of body site where the sample was obtained from, such as a specific organ or tissue (tongue, lung etc...). For foundational model of anatomy ontology (fma) (v 4.11.0) or Uber-anatomy ontology (UBERON) (v releases/2014-06-15) terms, please see http://purl.bioontology.org/ontology/FMA or http://purl.bioontology.org/ontology/UBERON.
MIXS:0000757	wind_direction	wind direction	cardinal wind direction or azimuth degrees	{text}	1	degrees or cardinal direction	Wind direction is the direction from which a wind originates.
MIXS:0001057	plant_growth_med	plant growth medium	EO or enumeration	{termLabel} {[termID]} or [husk|other artificial liquid medium|other artificial solid medium|peat moss|perlite|pumice|sand|soil|vermiculite|water]	1		Specification of the media for growing the plants or tissue cultured samples, e.g. soil, aeroponic, hydroponic, in vitro solid culture medium, in vitro liquid culture medium. Recommended value is a specific value from EO:plant growth medium (follow this link for terms http://purl.obolibrary.org/obo/EO_0007147) or other controlled vocabulary
MIXS:0000829	season	season	autumn [NCIT:C94733], spring [NCIT:C94731], summer [NCIT:C94732], winter [NCIT:C94730]	{termLabel} {[termID]}	1		The season when sampling occurred. Any of the four periods into which the year is divided by the equinoxes and solstices. This field accepts terms listed under season (http://purl.obolibrary.org/obo/NCIT_C94729).
MIXS:0000009	lat_lon	geographic location (latitude and longitude)	decimal degrees, limit to 8 decimal points	{float} {float}	1		The geographical origin of the sample as defined by latitude and longitude. The values should be reported in decimal degrees and in WGS84 system
MIXS:0001040	climate_environment	climate environment	climate name;treatment interval and duration	{text};{Rn/start_time/end_time/duration}	m		Treatment involving an exposure to a particular climate; treatment regimen including how many times the treatment was repeated, how long each treatment lasted, and the start and end time of the entire treatment; can include multiple climates
MIXS:0000434	diss_inorg_carb	dissolved inorganic carbon	measurement value	{float} {unit}	1	microgram per liter, milligram per liter, parts per million	Dissolved inorganic carbon concentration in the sample, typically measured after filtering the sample using a 0.45 micrometer filter
MIXS:0000091	associated resource	relevant electronic resources	reference to resource	{PMID}|{DOI}|{URL}	m		A related resource that is referenced, cited, or otherwise associated to the sequence. 
MIXS:0000753	oxy_stat_samp	oxygenation status of sample	enumeration	[aerobic|anaerobic|other]	1		Oxygenation status of sample.
MIXS:0000109	samp_salinity	sample salinity	measurement value	{float} {unit}	1	milligram per liter, practical salinity unit, percentage	Salinity is the total concentration of all dissolved salts in a liquid or solid (in the form of an extract obtained by centrifugation) sample. While salinity can be measured by a complete chemical analysis, this method is difficult and time consuming. More often, it is instead derived from the conductivity measurement. This is known as practical salinity. These derivations compare the specific conductance of the sample to a salinity standard such as seawater
MIXS:0000002	samp_collect_device	sample collection device	device name	{termLabel} {[termID]}|{text}	1		The device used to collect an environmental sample. This field accepts terms listed under environmental sampling device (http://purl.obolibrary.org/obo/ENVO). This field also accepts terms listed under specimen collection device (http://purl.obolibrary.org/obo/GENEPIO_0002094).
MIXS:0001069	standing_water_regm	standing water regimen	standing water type;treatment interval and duration	{text};{period};{interval};{period}	m		Treatment involving an exposure to standing water during a plant's life span, types can be flood water or standing water, treatment regimen including how many times the treatment was repeated, how long each treatment lasted, and the start and end time of the entire treatment; can include multiple regimens
MIXS:0000255	host_age	host age	age of the symbiotic organism (host of the samples); value	{float} {unit}	1	year, day, hour	Age of host at the time of sampling; relevant scale depends on species and study, e.g. Could be seconds for amoebae or centuries for trees.
MIXS:0000001	samp_size	amount or size of sample collected	measurement value	{float} {unit}	1	liter, gram, cm^2	The total amount or size (volume (ml), mass (g) or area (m2) ) of sample collected.
MIXS:0000515	part_org_carb	particulate organic carbon	measurement value	{float} {unit}	1	microgram per liter	Concentration of particulate organic carbon
MIXS:0000211	porosity	porosity	measurement value range	{float} - {float} {unit}	1	percentage	Porosity of deposited sediment is volume of voids divided by the total volume of sample.
MIXS:0001123	farm_equip_shared	equipment shared with other farms	AGRO:00000416	{termLabel} {[termID]}	m		List of planting, growing or harvesting equipment shared with other farms. This field accepts terms listed under agricultural implement (http://purl.obolibrary.org/obo/AGRO_00000416). Multiple terms can be separated by pipes.
MIXS:0000114	ventilation_rate	ventilation rate	measurement value	{float} {unit}	1	cubic meter per minute, liters per second	Ventilation rate of the system in the sampled premises.
MIXS:0001040	climate_environment	climate environment	climate name;treatment duration;interval;experimental duration	{text};{period};{interval};{period}	m		Treatment involving an exposure to a particular climate; treatment regimen including how many times the treatment was repeated, how long each treatment lasted, and the start and end time of the entire treatment; can include multiple climates
MIXS:0000645	season_precpt	mean seasonal precipitation	measurement value	{float} {unit}	1	millimeter	The average of all seasonal precipitation values known, or an estimated equivalent value derived by such methods as regional indexes or Isohyetal maps.
MIXS:0000111	samp_vol_we_dna_ext	sample volume or weight for DNA extraction	measurement value	{float} {unit}	1	millliter, gram, milligram	Volume (ml), weight (g) of processed sample, or surface area swabbed from sample for DNA extraction.
MIXS:0000185	water_content	water content	measurement value	{float} {unit}	1	gram per gram or cubic centimeter per cubic centimeter	Water content measurement
MIXS:0000591	watering_regm	watering regimen	measurement value;treatment interval and duration	{float} {unit};{Rn/start_time/end_time/duration}	m	milliliter, liter	Information about treatment involving an exposure to watering frequencies, treatment regimen including how many times the treatment was repeated, how long each treatment lasted, and the start and end time of the entire treatment; can include multiple regimens
MIXS:0000755	samp_store_loc	sample storage location	location name	{text}	1		Location at which sample was stored, usually name of a specific freezer/room.
MIXS:0000557	fungicide_regm	fungicide regimen	fungicide name;fungicide amount;treatment interval and duration	{text};{float} {unit};{Rn/start_time/end_time/duration}	m	gram, mole per liter, milligram per liter	Information about treatment involving use of fungicides; should include the name of fungicide, amount administered, treatment regimen including how many times the treatment was repeated, how long each treatment lasted, and the start and end time of the entire treatment; can include multiple fungicide regimens
MIXS:0000573	pesticide_regm	pesticide regimen	pesticide name;pesticide amount;treatment interval and duration	{text};{float} {unit};{Rn/start_time/end_time/duration}	m	gram, mole per liter, milligram per liter	Information about treatment involving use of insecticides; should include the name of pesticide, amount administered, treatment regimen including how many times the treatment was repeated, how long each treatment lasted, and the start and end time of the entire treatment; can include multiple pesticide regimens
MIXS:0000859	genetic_mod	genetic modification	PMID,DOI,url, or text	{PMID}|{DOI}|{URL}|{text}	1		Genetic modifications of the genome of an organism, which may occur naturally by spontaneous mutation, or be introduced by some experimental means, e.g. specification of a transgene or the gene knocked-out or details of transient transfection
MIXS:0000365	host_genotype	host genotype	genotype	{text}	1		Observed genotype.
MIXS:0001113	animal_feed_equip	animal feeding equipment	EOL:0001757	{termLabel} {[termID]}	m		Description of the feeding equipment used for livestock. This field accepts terms listed under feed delivery (http://opendata.inra.fr/EOL/EOL_0001757). Multiple terms can be separated by one or more pipes.
MIXS:0000016	samp_mat_process	sample material processing	text	{text}	1		A brief description of any processing applied to the sample during or after retrieving the sample from environment, or a link to the relevant protocol(s) performed.
MIXS:0001107	samp_name	sample name	text	{text}	1	 	A local identifier or name that for the material sample used for extracting nucleic acids, and subsequent sequencing. It can refer either to the original material collected or to any derived sub-samples. It can have any format, but we suggest that you make it concise, unique and consistent within your lab, and as informative as possible. INSDC requires every sample name from a single Submitter to be unique. Use of a globally unique identifier for the field source_mat_id is recommended in addition to sample_name.
MIXS:0000110	samp_store_temp	sample storage temperature	measurement value	{float} {unit}	1	degree Celsius	Temperature at which sample was stored, e.g. -80 degree Celsius.
MIXS:0001145	library_prep_kit	library preparation kit	name of library preparation kit	{text}	1		Packaged kits (containing adapters, indexes, enzymes, buffers etc.), tailored for specific sequencing workflows, which allow the simplified preparation of sequencing-ready libraries for small genomes, amplicons, and plasmids.
MIXS:0000337	tot_org_c_meth	total organic carbon method	PMID, DOI or URL	{PMID}|{DOI}|{URL}	1		Reference or method used in determining total organic carbon.
MIXS:0000205	org_nitro	organic nitrogen	measurement value	{float} {unit}	1	microgram per liter, micromole per liter	Concentration of organic nitrogen
MIXS:0001309	host_symbiont_symbiont	observed symbionts symbionts	symbionts of the symbiotic organism (host of the samples). e.g.: annotating a sample collected from a trematode with a nematomorpha cyst consider: species name of the nematomorph; {species name} or {common name}	{text}			The taxonomic name of the organism(s) found living in mutualistic, commensalistic, or parasitic symbiosis with the specific host. For cases when the specific host of the sample is a symbiont this field should refer to other organisms it is associated with. E.g.: hyperparasite species X (parasite of the parasite)
MIXS:0000103	organism_count	organism count	organism name; measurement value; enumeration	{text};{float} {unit};[ATP|MPN|qPCR|spread plate|other]	m	number of cells per cubic meter, number of cells per milliliter, number of cells per cubic centimeter	Total cell count of any organism (or group of organisms) per gram, volume or area of sample, should include name of organism followed by count. The method that was used for the enumeration (e.g. qPCR, atp, mpn, etc.) Should also be provided. (example: total prokaryotes; 3.5e7 cells per ml; qpcr)
MIXS:0000315	previous_land_use	history/previous land use	land use name;date	{text};{timestamp}	1		Previous land use and dates.
MIXS:0001038	biotic_regm	biotic regimen	free text	{text}	m		Information about treatment(s) involving use of biotic factors, such as bacteria, viruses or fungi.
MIXS:0001044	growth_habit	growth habit	enumeration	[erect|semi-erect|spreading|prostrate]	1		Characteristic shape, appearance or growth form of a plant species.
MIXS:0000112	solar_irradiance	mean seasonal solar irradiance	measurement value	{float} {unit}	m	kilowatts per square meter per day, ergs per square centimeter per second	The amount of solar energy that arrives at a specific area of a surface during a specific time interval
MIXS:0001106	ph_meth	pH method	PMID, DOI or URL	{PMID}|{DOI}|{URL}	1		Reference or method used in determining ph
MIXS:0001309	host_symbiont_symbiont	observed symbionts symbionts	symbionts of the symbiotic organism (host of the samples). e.g.: annotating a sample collected from a trematode with a nematomorpha cyst consider: species name of the nematomorph; {species name} or {common name}	{text}	1		The taxonomic name of the organism(s) found living in mutualistic, commensalistic, or parasitic symbiosis with the specific host. For cases when the specific host of the sample is a symbiont this field should refer to other organisms it is associated with. E.g.: hyperparasite species X (parasite of the parasite).
MIXS:0000162	diss_org_nitro	dissolved organic nitrogen	measurement value	{float} {unit}	1	microgram per liter, milligram per liter	Dissolved organic nitrogen concentration measured as; total dissolved nitrogen - NH4 - NO3 - NO2
MIXS:0001124	farm_equip_san	farm equipment sanitization					Method used to sanitize growing and harvesting equipment including type and concentration of sanitizing solution and frequency of sanitization.
MIXS:0000162	diss_org_nitro	dissolved organic nitrogen	measurement value	{float} {unit}	1	micromole per liter, microgram per liter, milligram per liter	Dissolved organic nitrogen concentration measured as; total dissolved nitrogen - NH4 - NO3 - NO2
MIXS:0001184	food_product_type	food product type	FOODON:00001002 or FOODON:03309997	{text}|{termLabel} {[termID]}	m		A food product type is a class of food products that is differentiated by its food composition (e.g., single- or multi-ingredient), processing and/or consumption characteristics. This does not include brand name products but it may include generic food dish categories. This field accepts terms under food product type (http://purl.obolibrary.org/obo/FOODON:03400361). For terms related to food product for an animal, consult food product for animal (http://purl.obolibrary.org/obo/FOODON_03309997). If the proper descriptor is not listed please use text to describe the food type. Multiple terms can be separated by one or more pipes.
MIXS:0000106	diss_inorg_phosp	dissolved inorganic phosphorus	measurement value	{float} {unit}	1	microgram per liter, milligram per liter, parts per million	Concentration of dissolved inorganic phosphorus in the sample
MIXS:0000001	samp_size	amount or size of sample collected	measurement value	{float} {unit}	1	millliter, gram, milligram	The total amount or size (volume (ml), mass (g) or area (m2) ) of sample collected.
MIXS:0000591	watering_regm	watering regimen	measurement value;treatment duration;interval;experimental duration	{float} {unit};{period};{interval};{period}	m	milliliter, liter	Information about treatment involving an exposure to watering frequencies, treatment regimen including how many times the treatment was repeated, how long each treatment lasted, and the start and end time of the entire treatment; can include multiple regimens
MIXS:0001133	food_harvest_proc	Food harvesting process	free text	{text}	m		A harvesting process is a process which takes in some food material from an individual or community of plant or animal organisms in a given context and time, and outputs a precursor or consumable food product. This may include a part of an organism or the whole, and may involve killing the organism.
MIXS:0001159	soil_cover	soil cover	ENVO:00010483	{termLabel} {[termID]}	1		Description of the material covering the sampled soil. This field accepts terms under ENVO:00010483, environmental material.
MIXS:0000533	tot_org_carb	total organic carbon	measurement value	{float} {unit}	1	gram Carbon per kilogram sample material	Definition for soil: total organic carbon content of the soil, definition otherwise: total organic carbon content
MIXS:0000094	alt	altitude	measurement value	{float} {unit}	1		Altitude is a term used to identify heights of objects such as airplanes, space shuttles, rockets, atmospheric balloons and heights of places such as atmospheric layers and clouds. It is used to measure the height of an object which is above the earth's surface. In this context, the altitude measurement is the vertical distance between the earth's surface above sea level and the sampled position in the air
MIXS:0000183	salinity	salinity	measurement value	{float} {unit}	1	practical salinity unit, percentage	The total concentration of all dissolved salts in a liquid or solid sample. While salinity can be measured by a complete chemical analysis, this method is difficult and time consuming. More often, it is instead derived from the conductivity measurement. This is known as practical salinity. These derivations compare the specific conductance of the sample to a salinity standard such as seawater.
MIXS:0000736	size_frac_up	size-fraction upper threshold	value	{float} {unit}	1	micrometer	Refers to the mesh/pore size used to retain the sample. Materials smaller than the size threshold are excluded from the sample
MIXS:0000094	alt	altitude	measurement value	{float} {unit}	1	meter	Altitude is a term used to identify heights of objects such as airplanes, space shuttles, rockets, atmospheric balloons and heights of places such as atmospheric layers and clouds. It is used to measure the height of an object which is above the earth's surface. In this context, the altitude measurement is the vertical distance between the earth's surface above sea level and the sampled position in the air
MIXS:0000338	tot_nitro_cont_meth	total nitrogen content method	PMID, DOI or URL	{PMID}|{DOI}|{URL}	m		Reference or method used in determining the total nitrogen.
MIXS:0001124	farm_equip_san	farm equipment sanitization	text or commercial name of sanitizer or class of sanitizer or active ingredient in sanitizer	{text} {float} {unit}	m	parts per million	Method used to sanitize growing and harvesting equipment. This can including type and concentration of sanitizing solution.  Multiple terms can be separated by one or more pipes.
MIXS:0001107	samp_name	sample name	text	{text}	1		A local identifier or name that for the material sample used for extracting nucleic acids, and subsequent sequencing. It can refer either to the original material collected or to any derived sub-samples. It can have any format, but we suggest that you make it concise, unique and consistent within your lab, and as informative as possible. INSDC requires every sample name from a single Submitter to be unique. Use of a globally unique identifier for the field source_mat_id is recommended in addition to sample_name.
MIXS:0001133	food_harvest_proc	Food harvesting process					A harvesting process is a process which takes in some food material from an individual or community of plant or animal organisms in a given context and time, and outputs a precursor or consumable food product. This may include a part of an organism or the whole, and may involve killing the organism.
MIXS:0000059	annot	annotation	annotation source description	{text}	1		Tool used for annotation, or for cases where annotation was provided by a community jamboree or model organism database rather than by a specific submitter
MIXS:0001147	lot_number	lot number	lot number, item	{integer}, {text}	m		A distinctive alpha-numeric identification code assigned by the manufacturer or distributor to a specific quantity of manufactured material or product within a batch. Synonym: Batch Number.  The submitter should provide lot number of the item followed by the item name for which the lot number was provided.
MIXS:0000503	n_alkanes	n-alkanes	n-alkane name;measurement value	{text};{float} {unit}	m	micromole per liter	Concentration of n-alkanes; can include multiple n-alkanes
MIXS:0000590	water_temp_regm	water temperature regimen	measurement value;treatment interval and duration	{float} {unit};{Rn/start_time/end_time/duration}	m	degree Celsius	Information about treatment involving an exposure to water with varying degree of temperature, treatment regimen including how many times the treatment was repeated, how long each treatment lasted, and the start and end time of the entire treatment; can include multiple regimens
MIXS:0000318	crop_rotation	history/crop rotation	crop rotation status;schedule	{boolean};Rn/{timestamp}/{period}	1		Whether or not crop is rotated, and if yes, rotation schedule
MIXS:0000204	org_matter	organic matter	measurement value	{float} {unit}	1	microgram per liter, milligram per cubic meter	Concentration of organic matter
MIXS:0000327	store_cond	storage conditions	storage condition type;duration	{text};{period}	1		Explain how and for how long the soil sample was stored before DNA extraction (fresh/frozen/other).
MIXS:0000257	host_dry_mass	host dry mass	measurement value	{float} {unit}	1	kilogram, gram	Measurement of dry mass.
MIXS:0000008	experimental_factor	experimental factor	text or EFO and/or OBI	{termLabel} {[termID]}|{text}	m		Experimental factors are essentially the variable aspects of an experiment design which can be used to describe an experiment, or set of experiments, in an increasingly detailed manner. This field accepts ontology terms from Experimental Factor Ontology (EFO) and/or Ontology for Biomedical Investigations (OBI). For a browser of EFO (v 2.95) terms, please see http://purl.bioontology.org/ontology/EFO; for a browser of OBI (v 2018-02-12) terms please see http://purl.bioontology.org/ontology/OBI.
MIXS:0000318	crop_rotation	history/crop rotation	crop rotation status;schedule	{boolean};{Rn/start_time/end_time/duration}	1		Whether or not crop is rotated, and if yes, rotation schedule.
MIXS:0000263	host_tot_mass	host total mass	mass of the symbiotic organism (host of the samples); measurement value	{float} {unit}	1	kilogram, gram, cell number	Total mass of the host at collection, the unit depends on host.
MIXS:0000874	host_phenotype	host phenotype	symbiotic organism (host of the samples) specific phenotype ontology terms; OBA or PTO or free text	{term}			Phenotype of human or other host. For phenotypic quality ontology (pato) (v 2018-03-27) terms, please see http://purl.bioontology.org/ontology/pato. For Human Phenotype Ontology (HP) (v 2018-06-13) please see http://purl.bioontology.org/ontology/HP.
MIXS:0000828	samp_floor	sampling floor	enumeration	[1st floor|2nd floor|{integer} floor|basement|lobby]	1		The floor of the building, where the sampling room is located
MIXS:0000754	perturbation	perturbation	perturbation type name;perturbation interval and duration	{text};{Rn/start_time/end_time/duration}	m		Type of perturbation, e.g. chemical administration, physical disturbance, etc., coupled with perturbation regimen including how many times the perturbation was repeated, how long each perturbation lasted, and the start and end time of the entire perturbation period; can include multiple perturbation types
